<?xml version="1.0" encoding="utf-8"?>
<xsd:schema xmlns:xsd="http://www.w3.org/2001/XMLSchema">
<xsd:include schemaLocation="_ability.xsd"/>

<!-- 
	Total Boum Boum
	Copyright 2008-2013 Vincent Labatut 
	
	This file is part of Total Boum Boum.
	
	Total Boum Boum is free software: you can redistribute it and/or modify
	it under the terms of the GNU General Public License as published by
	the Free Software Foundation, either version 2 of the License, or
	(at your option) any later version.
	
	Total Boum Boum is distributed in the hope that it will be useful,
	but WITHOUT ANY WARRANTY; without even the implied warranty of
	MERCHANTABILITY or FITNESS FOR A PARTICULAR PURPOSE.  See the
	GNU General Public License for more details.
	
	You should have received a copy of the GNU General Public License
	along with Total Boum Boum.  If not, see <http://www.gnu.org/licenses/>.
-->

	<xsd:complexType name="tModulation">
		<xsd:attribute name="frame" type="xsd:boolean" use="optional" default="false" />
		<xsd:attribute name="strength" type="xsd:string" use="optional" default="0" />
	</xsd:complexType>

	<xsd:complexType name="tExtendedModulation">
		<xsd:complexContent>
			<xsd:extension base="tModulation">
				<xsd:attribute name="contact" type="tContactList" use="optional" default="ANY" />
				<xsd:attribute name="tilePosition" type="tTilePositionList" use="optional" default="ANY" />
			</xsd:extension>
		</xsd:complexContent>
	</xsd:complexType>

	<xsd:complexType name="tSelfModulation">
		<xsd:complexContent>
			<xsd:extension base="tModulation">
				<xsd:sequence>
					<xsd:element name="name" type="tAbilityName" />
				</xsd:sequence>
			</xsd:extension>
		</xsd:complexContent>
	</xsd:complexType>

	<xsd:complexType name="tOtherModulation">
		<xsd:complexContent>
			<xsd:extension base="tExtendedModulation">
				<xsd:sequence>
					<xsd:element name="name" type="tAbilityName" />
				</xsd:sequence>
			</xsd:extension>
		</xsd:complexContent>
	</xsd:complexType>

	<xsd:complexType name="tRestrictions">
		<xsd:sequence>
			<xsd:element name="ability" type="tAbility" minOccurs="0" maxOccurs="unbounded" />
		</xsd:sequence>
	</xsd:complexType>

	<xsd:complexType name="tActorModulation">
		<xsd:complexContent>
			<xsd:extension base="tModulation">
				<xsd:sequence>
					<xsd:element name="action" type="tActionActor" />
					<xsd:element name="actorRestrictions" type="tRestrictions" minOccurs="0" />
					<xsd:element name="targetRestrictions" type="tRestrictions" minOccurs="0" />
				</xsd:sequence>
			</xsd:extension>
		</xsd:complexContent>
	</xsd:complexType>

	<xsd:complexType name="tTargetModulation">
		<xsd:complexContent>
			<xsd:extension base="tModulation">
				<xsd:sequence>
					<xsd:element name="action" type="tActionTarget" />
					<xsd:element name="actorRestrictions" type="tRestrictions" minOccurs="0" />
					<xsd:element name="targetRestrictions" type="tRestrictions" minOccurs="0" />
				</xsd:sequence>
			</xsd:extension>
		</xsd:complexContent>
	</xsd:complexType>

	<xsd:complexType name="tCircumstances">
		<xsd:attribute name="contact" type="tContactList" use="optional" default="ANY" />
		<xsd:attribute name="tilePosition" type="tTilePositionList" use="optional" default="ANY" />
		<xsd:attribute name="orientation" type="tOrientationList" use="optional" default="ANY" />
	</xsd:complexType>

	<xsd:complexType name="tThirdModulation">
		<xsd:complexContent>
			<xsd:extension base="tExtendedModulation">
				<xsd:sequence>
					<xsd:element name="action" type="tActionThird" />
					<xsd:element name="actorRestrictions" type="tRestrictions" minOccurs="0" />
					<xsd:element name="targetRestrictions" type="tRestrictions" minOccurs="0" />
					<xsd:element name="actorCircumstances" type="tCircumstances" />
					<xsd:element name="targetCircumstances" type="tCircumstances" />
				</xsd:sequence>
			</xsd:extension>
		</xsd:complexContent>
	</xsd:complexType>

	<xsd:complexType name="tSelfModulations">
		<xsd:sequence>
			<xsd:element name="modulation" type="tSelfModulation" minOccurs="0" maxOccurs="unbounded" />
		</xsd:sequence>
	</xsd:complexType>

	<xsd:complexType name="tOtherModulations">
		<xsd:sequence>
			<xsd:element name="modulation" type="tOtherModulation" minOccurs="0" maxOccurs="unbounded" />
		</xsd:sequence>
	</xsd:complexType>

	<xsd:complexType name="tActorModulations">
		<xsd:sequence>
			<xsd:element name="modulation" type="tActorModulation" minOccurs="0" maxOccurs="unbounded" />
		</xsd:sequence>
	</xsd:complexType>

	<xsd:complexType name="tTargetModulations">
		<xsd:sequence>
			<xsd:element name="modulation" type="tTargetModulation" minOccurs="0" maxOccurs="unbounded" />
		</xsd:sequence>
	</xsd:complexType>

	<xsd:complexType name="tThirdModulations">
		<xsd:sequence>
			<xsd:element name="modulation" type="tThirdModulation" minOccurs="0" maxOccurs="unbounded" />
		</xsd:sequence>
	</xsd:complexType>

	<xsd:complexType name="tGestureModulations">
		<xsd:sequence>
			<xsd:element name="selfModulations" type="tSelfModulations" />
			<xsd:element name="otherModulations" type="tOtherModulations" />
			<xsd:element name="actorModulations" type="tActorModulations" />
			<xsd:element name="targetModulations" type="tTargetModulations" />
			<xsd:element name="thirdModulations" type="tThirdModulations" />
		</xsd:sequence>
	</xsd:complexType>

	<xsd:element name="gesture-modulations" type="tGestureModulations" />

</xsd:schema>
