<?xml version="1.0" encoding="utf-8"?>
<gesture-modulations xmlns:xsi="http://www.w3.org/2001/XMLSchema-instance" 
		xsi:noNamespaceSchemaLocation="../../../../../../../../schemas/gesture_modulations.xsd" >

	<selfModulations>
	</selfModulations>
	
	<otherModulations>
	</otherModulations>
	
	<actorModulations>
	</actorModulations>
	
	<targetModulations>
<!--  	CONSUME --> 
		<modulation frame="true" strength="0" >
			<action name="CONSUME" direction="ANY" contact="ANY"
				tilePosition="ANY" orientation="ANY" actor="SOME" />
			<actorRestrictions />
			<targetRestrictions />
		</modulation>
	</targetModulations>
	
	<thirdModulations>
	</thirdModulations>

</gesture-modulations>
